{
  "id": "map_main",
  "name": "主战场 · 四路汇入中央宝库",
  "grid": { "width": 48, "height": 33 },
  "vault": { "x": 22, "y": 14, "w": 5, "h": 5 },
  "buildDepth": 2,
  "haltPointsPerLane": 1,
  "paths": [
    {
      "id": 0,
      "lane": "A",
      "name": "左上入口",
      "waypoints": [
        { "x": 3000, "y": 1000 },
        { "x": 3000, "y": 10000 },
        { "x": 18000, "y": 10000 },
        { "x": 18000, "y": 16000 },
        { "x": 24000, "y": 16000 }
      ],
      "haltIndex": 2,
      "pathLengthCells": 36000
    },
    {
      "id": 1,
      "lane": "C",
      "name": "左下入口",
      "waypoints": [
        { "x": 3000, "y": 31000 },
        { "x": 3000, "y": 22000 },
        { "x": 18000, "y": 22000 },
        { "x": 18000, "y": 14000 },
        { "x": 24000, "y": 14000 }
      ],
      "haltIndex": 2,
      "pathLengthCells": 38000
    },
    {
      "id": 2,
      "lane": "B",
      "name": "右上入口",
      "waypoints": [
        { "x": 45000, "y": 1000 },
        { "x": 45000, "y": 10000 },
        { "x": 30000, "y": 10000 },
        { "x": 30000, "y": 16000 },
        { "x": 24000, "y": 16000 }
      ],
      "haltIndex": 2,
      "pathLengthCells": 36000
    },
    {
      "id": 3,
      "lane": "D",
      "name": "右下入口",
      "waypoints": [
        { "x": 45000, "y": 31000 },
        { "x": 45000, "y": 22000 },
        { "x": 30000, "y": 22000 },
        { "x": 30000, "y": 18000 },
        { "x": 24000, "y": 18000 }
      ],
      "haltIndex": 2,
      "pathLengthCells": 34000
    }
  ],
  "openLanes": {
    "N1": [0, 1],
    "N2": [0, 1],
    "N3": [0, 1, 2, 3],
    "N4": [0, 1, 2, 3],
    "N5": [0, 1, 2, 3]
  },
  "description": "起点几何取自 engine-dev 的 M0 夹具（48×33 / 宝库 22,14 5×5 / 可建造区深度 2），已由 balance-eng 的适配层验证可构建。数组顺序为 A(左上)、C(左下)、B(右上)、D(右下)：这样 N1/N2 开放的前 2 条正好是策划案 §4.6 写的「A、C」，同时 §14.2 波次示例里的 path:[0,1] 在 2 路与 4 路难度下都合法。实测折线长 36/38/36/38 格，与 §4.6「约 40 格」同量级（偏短 5%–10%）。所有路径末点都落在宝库矩形内。"
}
